{
  "id": "mayan_chaac",
  "name": "Maya - Chaac",
  "tableDisplay": {
    "defaultSort": "importance",
    "columns": {
      "name": {
        "sortable": true,
        "label": "Name"
      },
      "mythology": {
        "label": "Mythology",
        "sortable": true
      },
      "domains": {
        "sortable": false,
        "label": "Domains"
      },
      "importance": {
        "sortable": true,
        "label": "Importance"
      }
    },
    "defaultOrder": "desc"
  },
  "type": "deity",
  "popularity": 40,
  "sortName": "mayachaac",
  "_enhanced": true,
  "mythology": "mayan",
  "css_colors": {
    "secondary": "#00CED1",
    "primary_rgb": "30, 144, 255",
    "primary": "#1E90FF"
  },
  "_uploadedAt": "2025-12-25T15:46:26.319076",
  "_modified": "2025-12-25T05:23:54.933Z",
  "panelDisplay": {
    "sections": [
      {
        "content": "Among the oldest and most widely worshipped deities of the Maya, Chaac is the god of rain, thunder,\n                and lightning. With his distinctive long nose and jade ornaments, he wields a great lightning axe\n                to split the clouds and release the waters that sustain all life. As the lord of agriculture and\n                fertility, Chaac was essential to Maya survival, his favor bringing bountiful harvests and his\n                anger devastating droughts. His goggle-eyed visage adorns countless temples across the Maya world.",
        "title": "Description",
        "type": "text"
      }
    ],
    "layout": "hero"
  },
  "corpusSearch": {
    "concepts": [],
    "epithets": [],
    "variants": [
      "mayachaac",
      "maya - chaac"
    ],
    "symbols": [],
    "domains": [],
    "places": [],
    "canonical": "mayachaac"
  },
  "subtitle": "Chaahk- \"Thunder\" / \"Lightning Strike\"",
  "_created": "2025-12-25T05:23:54.933Z",
  "gridDisplay": {
    "stats": [
      {
        "value": "Unknown",
        "label": "Domain"
      },
      {
        "label": "Symbol",
        "value": "ðŸŒ§"
      }
    ],
    "subtitle": "Chaahk- \"Thunder\" / \"Lightning Strike\"",
    "title": "Maya - Chaac",
    "hoverInfo": {
      "quick": "Among the oldest and most widely worshipped deities of the Maya, Chaac is the god of rain, thunder,\n...",
      "domains": []
    },
    "image": "ðŸŒ§",
    "badge": "Mayan"
  },
  "importance": 60,
  "searchTerms": [
    "maya - chaac",
    "mayan",
    "among",
    "oldest",
    "most",
    "widely",
    "worshipped",
    "deities",
    "maya",
    "chaac",
    "rain",
    "thunder",
    "lightning",
    "with",
    "distinctive",
    "long",
    "nose",
    "jade",
    "ornaments",
    "wields",
    "great",
    "split",
    "clouds",
    "release",
    "waters",
    "that",
    "sustain",
    "life",
    "lord",
    "agriculture",
    "fertility",
    "essential",
    "survival",
    "favor",
    "bringing",
    "bountiful",
    "harvests",
    "anger",
    "devastating",
    "droughts",
    "goggle",
    "eyed",
    "visage",
    "adorns",
    "countless",
    "temples",
    "across",
    "world",
    "chaahk",
    "strike"
  ],
  "listDisplay": {
    "primary": "Maya - Chaac - Chaahk- \"Thunder\" / \"Lightning Strike\"",
    "secondary": "Among the oldest and most widely worshipped deities of the Maya, Chaac is the god of rain, thunder,\n...",
    "icon": "ðŸŒ§",
    "meta": "Mayan Mythology",
    "expandable": true,
    "expandedContent": "Among the oldest and most widely worshipped deities of the Maya, Chaac is the god of rain, thunder,\n                and lightning. With his distinctive long nose and jade ornaments, he wields a great lightning axe\n                to split the clouds and release the waters that sustain all life. As the lord of agriculture and\n                fertility, Chaac was essential to Maya survival, his favor bringing bountiful harvests and his\n                anger devastating droughts. His goggle-eyed visage adorns countless temples across the Maya world."
  },
  "icon": "ðŸŒ§",
  "entityType": "unknown",
  "_version": "2.0",
  "description": "Among the oldest and most widely worshipped deities of the Maya, Chaac is the god of rain, thunder,\n                and lightning. With his distinctive long nose and jade ornaments, he wields a great lightning axe\n                to split the clouds and release the waters that sustain all life. As the lord of agriculture and\n                fertility, Chaac was essential to Maya survival, his favor bringing bountiful harvests and his\n                anger devastating droughts. His goggle-eyed visage adorns countless temples across the Maya world.",
  "summary": "Among the oldest and most widely worshipped deities of the Maya, Chaac is the god of rain, thunder,\n                and lightning. With his distinctive long nose and jade ornaments, he wields a great lightning axe\n                to split the clouds and release the waters that sustain all life. As the lord of agriculture and\n                fertility, Chaac was essential to Maya survival, his favor bringing bountiful harvests and his\n                anger devastating droughts. His goggle-eyed visage adorns countless temples across the Maya world.",
  "relationships": {
    "relatedIds": [],
    "collections": [],
    "mythology": "mayan"
  },
  "metadata": {
    "featured": false,
    "visibility": "public",
    "created": {
      "_seconds": 1766721531,
      "_nanoseconds": 224000000
    },
    "importance": 50,
    "category": "deity",
    "updated": {
      "_seconds": 1766721564,
      "_nanoseconds": 164000000
    },
    "status": "published",
    "tags": []
  },
  "search": {
    "aliases": [],
    "keywords": [
      "maya - chaac",
      "maya",
      "chaac"
    ],
    "searchableText": "maya - chaac chaahk- \"thunder\" / \"lightning strike\" among the oldest and most widely worshipped deities of the maya, chaac is the god of rain, thunder,\n                and lightning. with his distinctive long nose and jade ornaments, he wields a great lightning axe\n                to split the clouds and release the waters that sustain all life. as the lord of agriculture and\n                fertility, chaac was essential to maya survival, his favor bringing bountiful harvests and his\n                anger devastating droughts. his goggle-eyed visage adorns countless temples across the maya world. among the oldest and most widely worshipped deities of the maya, chaac is the god of rain, thunder,\n                and lightning. with his distinctive long nose and jade ornaments, he wields a great lightning axe\n                to split the clouds and release the waters that sustain all life. as the lord of agriculture and\n                fertility, chaac was essential to maya survival, his favor bringing bountiful harvests and his\n                anger devastating droughts. his goggle-eyed visage adorns countless temples across the maya world. maya - chaac maya chaac",
    "facets": {
      "culture": "mayan",
      "power": "medium"
    }
  },
  "color": "#8b7fff",
  "rendering": {
    "defaultAction": "page",
    "modes": {
      "hyperlink": true,
      "subsection": true,
      "expandableRow": true,
      "fullPage": true,
      "panelCard": true
    },
    "defaultMode": "panelCard"
  }
}